{
  "canonicalization": "ECP-CANONICAL-JSON-1.0",
  "documentation": "spec/ECP-SPEC.md",
  "ecp_object": "protocol",
  "hash_algorithm": "sha256",
  "protocol_name": "ECP",
  "protocol_status": "draft",
  "protocol_title": "Evidentiary Evaluation Protocol",
  "protocol_version": "0.7.0",
  "repository_version": "0.7.0",
  "schema_version": "0.8.0"
}
